フェールソフト,システムの一部が故障したとき、機能を低下させてでもシステムを継続作動させる思想。飛行機のエンジンがいくつか止まっても、残りのエンジンで縮退動作を続けるなどが挙げられる。,5,0
フールプルーフ,誤作動が起きにくい仕様にし、意図していない操作をしても故障しないという思想。数字入力フィールドに数字以外のものが入力された場合、システムから警告メッセージを出力して正しい入力を要求する設計などが挙げられる。,5,0
MIPS,1秒間当たりに実行される命令の回数を百万単位で表記したもの。CPUの性能比較によく使われる。,12,0
ベンチマークテスト,使用目的に合わせて選定した標準的なプログラムを実行させ、その処理性能を測定するテスト手法。,5,0
平均故障間隔(MTBF),システムが故障してから、次にまた故障するまでの平均時間。この値が大きいほど信頼性が高いシステムと言える。,5,0
平均修理時間(MTTR),システム修理に要する平均時間。この値が小さいほど保守性の高いシステムと言える。,5,0
稼働率,システムが正常に稼働している割合。MTBF/(MTBF+MTTR)の数式で求められる。また、二つのシステムの稼働率をA、Bとしたとき、直列システムの稼働率はA×B、並列システムの稼働率は1-(1-A)(1-B)で求められる。,1,0
CIO,情報システムの立案から実行までの責任者。経営戦略を実現するため、全社的観点から情報化戦略を立案し、経営戦略との整合性の確認や評価を行う。,10,0
要件定義,新たに構築するシステムの仕様、機能、範囲を明確化し、それらを利害関係者で合意するプロセス。業務上実現すべきである業務要件、情報システムの機能を明確にする機能要件、性能や信頼性を明確にする非機能要件がある。,7,0
CSR,企業活動において経済的成長だけでなく、環境や社会からの要請に対し、責任を果たすことが企業価値の向上につながるという思想。企業の社会的責任という意味。,10,0
